{
  "$schema": "../schemas/release-manifest.schema.json",
  "releaseId": "rel-20261031-01",
  "version": "1.0.0-rc1",
  "previousReleaseId": null,
  "createdAt": "2026-10-30T19:30:00Z",
  "status": "prepared",
  "components": {
    "backend": {
      "repository": "supportflow-ai/ai-it-service-desk",
      "branch": "dev",
      "baselineCommit": "44ba0b4b4fc1ad6f515f8485b83736eccb127491",
      "sourceCommit": "44ba0b4b4fc1ad6f515f8485b83736eccb127491",
      "buildCommit": "adb43ae4de5f575b4bfd9559ae96105034a74022",
      "workflowRunId": 41115110483,
      "workflowRunUrl": "https://github.com/supportflow-ai/ai-it-service-desk/actions/runs/41115110483",
      "artifacts": {
        "api": {
          "image": "ghcr.io/supportflow-ai/servicedesk-api",
          "tag": "sha-adb43ae4de5f575b4bfd9559ae96105034a74022",
          "digest": "sha256:f28277ad51197f7974e29ff944b0e259d22420ffa49726419a85dec32d8ef334",
          "publicationStatus": "published",
          "description": "Backend ASP.NET Core Web API runtime service"
        },
        "worker": {
          "image": "ghcr.io/supportflow-ai/servicedesk-worker",
          "tag": "sha-adb43ae4de5f575b4bfd9559ae96105034a74022",
          "digest": "sha256:c10abca647303570a0589fe531a215c95b3c4673d884c8ef399337e163eba90b",
          "publicationStatus": "published",
          "description": "Backend background worker processing service"
        },
        "database": {
          "image": "ghcr.io/supportflow-ai/servicedesk-database",
          "tag": "sha-adb43ae4de5f575b4bfd9559ae96105034a74022",
          "digest": "sha256:f635c5790c4a526f7a640c02ef8911f61c746edbca67ce56a66fffd3cf1c8c01",
          "publicationStatus": "published",
          "description": "Database migration and seeding CLI tool (ServiceDesk.Database), not a PostgreSQL server"
        }
      }
    },
    "web": {
      "repository": "supportflow-ai/ai-it-service-desk-web",
      "branch": "dev",
      "baselineCommit": "fe42831726acc789c1d8eabe151ee3fd73597533",
      "sourceCommit": "fe42831726acc789c1d8eabe151ee3fd73597533",
      "buildCommit": "fb59a8e04c8fa104daed4886cf3b8eb6fc807477",
      "workflowRunId": 41115261596,
      "workflowRunUrl": "https://github.com/supportflow-ai/ai-it-service-desk-web/actions/runs/41115261596",
      "artifacts": {
        "web": {
          "image": "ghcr.io/supportflow-ai/servicedesk-web",
          "tag": "sha-fb59a8e04c8fa104daed4886cf3b8eb6fc807477",
          "digest": "sha256:3d787fe41b27c55c54ae2b1bb35c0cc127ec0ee40996790a47d66ce411caedc7",
          "publicationStatus": "published",
          "description": "React 19 + TypeScript frontend production build served via NGINX"
        }
      }
    },
    "aiService": {
      "repository": "supportflow-ai/ai-service",
      "branch": "ai-service",
      "baselineCommit": "66d5cefd846b40d6e2c0e793c589037dfa36e042",
      "sourceCommit": "66d5cefd846b40d6e2c0e793c589037dfa36e042",
      "buildCommit": "28f85014c391355b4791b9e1a65a1c215b41bac7",
      "workflowRunId": 41115433754,
      "workflowRunUrl": "https://github.com/supportflow-ai/ai-service/actions/runs/41115433754",
      "artifacts": {
        "aiService": {
          "image": "ghcr.io/supportflow-ai/servicedesk-ai-service",
          "tag": "sha-28f85014c391355b4791b9e1a65a1c215b41bac7",
          "digest": null,
          "publicationStatus": "pending",
          "description": "Stateless AI classification and triage service runtime"
        }
      }
    },
    "infrastructure": {
      "repository": "supportflow-ai/supportflow-ai-infra",
      "branch": "codex/infra-handoff",
      "baselineCommit": "80cdadada5e7bb253427161ea801c82866539ba0",
      "sourceCommit": "80cdadada5e7bb253427161ea801c82866539ba0",
      "buildCommit": "971b9d675d587cbd8f4f0964b933efa98ed208f6",
      "workflowRunId": 41119175623,
      "workflowRunUrl": "https://github.com/supportflow-ai/supportflow-ai-infra/actions/runs/41119175623",
      "artifacts": {
        "minio": {
          "image": "ghcr.io/supportflow-ai/servicedesk-minio",
          "tag": "sha-971b9d675d587cbd8f4f0964b933efa98ed208f6",
          "digest": null,
          "publicationStatus": "pending",
          "description": "Custom built MinIO object storage from upstream Go source"
        }
      }
    }
  },
  "thirdPartyDependencies": {
    "postgres": "pgvector/pgvector:pg17@sha256:ac08538c6f8b9904c33c8224c5e5706dbe760aca29db1d096972b4052c22a75d",
    "nginx": "nginx:alpine@sha256:785835ea65db4bba6f021acc0f3be91b0fef76a53fe41f8588c6698d2aed0606"
  },
  "databaseMigration": {
    "currentMigration": "20261030055303_AddTicketAssignmentPriorityAndCollaboration",
    "toolPurpose": "CLI database migration, role seeding and demo bootstrapping tool. It connects as owner for migrations and is not a PostgreSQL server."
  }
}
